id,title,post_hint,created_utc,ups,downs,upvote_ratio,score,subreddit_id,subreddit_name_prefixed,subreddit_subscribers,over_18,num_comments,is_original_content,is_self,is_video,author,author_fullname,author_premium,content_categories,edited,domain
17px794,On this day 3 years ago Rudy Giuliani held a press conference at Four Seasons Total Landscaping,image,1699372007.0,70187,0,0.91,70187,t5_2qh0u,r/pics,30277898,False,2580,False,False,False,ohnoh18,t2_3qo6zvfi,True,['photography'],False,i.redd.it
17pv6yo,TIL Aretha Franklin required that she be paid in cash before any performance. The cash went into her handbag and the handbag either stayed with her security team or would rest on the piano during her onstage performance.,link,1699366412.0,31025,0,0.95,31025,t5_2qqjc,r/todayilearned,33541740,False,746,False,False,False,trifletruffles,t2_4qxo2xud,False,,False,insider.com
17q3pck,The mic was in picture!,hosted:video,1699389165.0,29177,0,0.94,29177,t5_2qh33,r/funny,54094333,False,497,False,False,True,asap3210,t2_12cbv7,False,,False,v.redd.it
17ptujg,"TIL ex-Yahoo CEO Marissa Mayer admitted that in 2013 Yahoo should've purchased either Netflix at $4 billion or Hulu at $1.3 billion instead of buying Tumblr at $1.1 billion stating it ""would have been a better acquisition."" By 2016, Yahoo had to write down Tumblr's value by a total $712 million.",link,1699362314.0,24713,0,0.93,24713,t5_2qqjc,r/todayilearned,33541740,False,1807,False,False,False,tyrion2024,t2_ojnpnf61,False,,False,businessinsider.com
17ptg5p,8 Weeks vs 8 Years,image,1699361016.0,21625,0,0.96,21625,t5_2qh1o,r/aww,34865404,False,185,True,False,False,Mab_12,t2_4wutdy4j,False,,False,i.redd.it
17pth0j,I’m not much of a church person but this one deserved a photo,image,1699361095.0,21575,0,0.95,21575,t5_2qh0u,r/pics,30277898,False,597,False,False,False,visual_impact,t2_74ccu,False,['photography'],False,i.redd.it
17ptwgo,Fifty shades of Santa,hosted:video,1699362494.0,21617,0,0.88,21617,t5_2qh33,r/funny,54094333,True,455,False,False,True,NauTWitcher,t2_c72z3dwk,False,,False,v.redd.it
17q0k7c,Cat experiences true regret,hosted:video,1699380932.0,21788,0,0.94,21788,t5_2qh33,r/funny,54094333,False,244,False,False,True,doughb0ii,t2_ddgdiyd6,False,,False,v.redd.it
17pu819,"Waving white flags, Gaza civilians evacuate through humanitarian corridor secured by IDF tanks",link,1699363516.0,20510,0,0.85,20510,t5_2qh13,r/worldnews,33601186,False,4329,False,False,False,clarkhunterparks,t2_lnopf3ay,False,,False,ynetnews.com
17qb62n,Ohio voters enshrine abortion access in constitution in latest statewide win for reproductive rights,link,1699409364.0,20398,0,0.95,20398,t5_2qh3l,r/news,26961702,False,732,False,False,False,makingloudness,t2_lj3f4,False,,False,apnews.com
17q3sy5,Had a visitor today [OC],hosted:video,1699389422.0,18832,0,0.98,18832,t5_2qh1o,r/aww,34865404,False,183,True,False,True,lemongrade5,t2_15ej55,False,,False,v.redd.it
17puiv3,Musical whipping,hosted:video,1699364431.0,15655,0,0.93,15655,t5_2qh33,r/funny,54094333,False,336,False,False,True,PM_ME_YOR_BLOOMERS,t2_447b8pk,False,,False,v.redd.it
17pywfv,Angry Call of Duty fans are review-bombing the wrong Modern Warfare 3.,link,1699376566.0,15465,0,0.94,15465,t5_2qh03,r/gaming,38621515,False,1314,False,False,False,DonnyJC98-5,t2_utrg853s,False,,False,ign.com
17q5zk1,2 Month old running shoes vs brand new ones,image,1699394917.0,15717,0,0.83,15717,t5_2ti4h,r/mildlyinteresting,22642836,False,2398,True,False,False,Lands1id3,t2_3i7vyu6u,False,,False,i.redd.it
17q9u8m,Stefanie Germanotta (Lady Gaga) before she was famous,image,1699405444.0,15703,0,0.94,15703,t5_2qh0u,r/pics,30277898,False,628,False,False,False,RemarkablyIntresting,t2_kkya7iq0,False,['photography'],False,i.redd.it
17q5yms,Live Action Legend of Zelda movie officially announced,link,1699394849.0,13741,0,0.9,13741,t5_2qh3s,r/movies,31791946,False,2723,False,False,False,thecornballer1,t2_l39e5,False,,False,nintendo.co.jp
17ptod1,My hotel window opens.,image,1699361761.0,11607,0,0.94,11607,t5_2ti4h,r/mildlyinteresting,22642836,False,720,True,False,False,Steely-Dave,t2_6n86lo8w,False,,False,i.redd.it
17pyv69,Bored Ape NFT event leaves attendees blind and sunburnt by aggressive light show,link,1699376486.0,11511,0,0.95,11511,t5_2qnts,r/nottheonion,22808274,False,766,False,False,False,curlyhairedgal28,t2_w5auxud,False,,False,theguardian.com
17pzxps,My son's shirt pocket is upside down because it's a parachute,image,1699379290.0,11066,0,0.95,11066,t5_2ti4h,r/mildlyinteresting,22642836,False,175,True,False,False,FranniPants,t2_8mzmy,False,,False,i.redd.it
17pvyab,Jeremy Renner Says Snowplow Accident Taught Him ‘Not to Squander My Life': ‘It’s My Duty’,link,1699368600.0,10102,0,0.93,10102,t5_2u3ta,r/UpliftingNews,19396567,False,444,False,False,False,TheLuvBub,t2_uq10bjx9,False,,False,people.com
17q47oo,"TIL in 2005, Sothebys &amp; Christies had to play Rock-Paper-Scissors over an art collection. Sothebys assumed it was random chance, so had no strategy. But Christies studied the game &amp; asked two 11yo twin girls, who picked scissors: “Rock is way too obvious, and scissors beats paper.” Christies won.",link,1699390507.0,10241,0,0.94,10241,t5_2qqjc,r/todayilearned,33541740,False,384,False,False,False,Pfeffer_Prinz,t2_gv8sbfe0,False,,False,cnn.com
17pq3x6,The Minibar at Virgins Hotel,image,1699347445.0,10029,0,0.93,10029,t5_2ti4h,r/mildlyinteresting,22642836,False,850,True,False,False,TheGlueGun,t2_7k12dlc,False,,False,i.redd.it
17px6l3,My husband's 5 year old wok vs the brand new one,image,1699371958.0,10114,0,0.85,10114,t5_2ti4h,r/mildlyinteresting,22642836,False,1286,True,False,False,linyx-_-,t2_izmriwav,False,,False,i.redd.it
17q77bx,TIL I can guess when my 6 months kitten is about to pounce by how his pupils dilate. ,hosted:video,1699398047.0,11363,0,0.98,11363,t5_2qh1o,r/aww,34865404,False,76,True,False,True,Alzzary,t2_mq7wb,False,,False,v.redd.it
17pz18b,"3 yrs ago today, Rudy Giuliani held a press conference for Trump at Four Seasons Total Landscaping",image,1699376913.0,9296,0,0.95,9296,t5_2qh0u,r/pics,30277898,False,231,False,False,False,WartimeHotTot,t2_y9a4a,False,['photography'],False,i.redd.it
17q0tyn,"Newborn syphilis cases have reached 'dire levels,' CDC says",link,1699381657.0,9154,0,0.97,9154,t5_2qh3l,r/news,26961702,False,529,False,False,False,MMccLLoovviinn,t2_cnfdyhu0d,False,,False,nbcnews.com
17pwcvg,Bye Bye Zero Punctuation,link,1699369741.0,9031,0,0.94,9031,t5_2qh03,r/gaming,38621515,False,1146,False,False,False,KingCarbon1807,t2_29nienjw,False,,False,forbes.com
17ptynf,Moms for Liberty Member Demands Florida Librarians' Arrest,link,1699362689.0,8785,0,0.92,8785,t5_2qh3l,r/news,26961702,False,1174,False,False,False,sue_me_please,t2_137g8k1p,False,,False,miaminewtimes.com
17qag5h,They were handing out these drug emoji guides at a safety fair,image,1699407233.0,9571,0,0.95,9571,t5_2ti4h,r/mildlyinteresting,22642836,False,1434,True,False,False,jhreels,t2_zv9h6,False,,False,i.redd.it
17pv7u1,‘Elf’ at 20: Will Ferrell ensures that this remains a Christmas staple,link,1699366484.0,8682,0,0.9,8682,t5_2qh3s,r/movies,31791946,False,841,False,False,False,MarvelsGrantMan136,t2_5adwlxvn,True,,False,theguardian.com
17puedj,"TIL: This year Belgian Customs destroyed 2,352 cans of Miller High Life because it had the word Champagne on them",link,1699364058.0,8200,0,0.97,8200,t5_2qqjc,r/todayilearned,33541740,False,534,False,False,False,jadraxx,t2_4p7es,False,,False,foodandwine.com
17q9deq,Noah's arc  by Adrian Bliss,hosted:video,1699404095.0,9424,0,0.92,9424,t5_2qh33,r/funny,54094333,False,161,False,False,True,throwaway98cgu566,t2_ch0g1v5z,False,,False,v.redd.it
17q180b,Listen to the exact moment when The Doors thought of the idea to add thunder sounds to “Riders on the Storm” for the very first time. 1970.,hosted:video,1699382645.0,7877,0,0.97,7877,t5_2tycb,r/OldSchoolCool,18306435,False,222,False,False,True,waitingforthesun92,t2_by3ixbpd,False,,False,v.redd.it
17pznbm,What “unforgivable” act by a celebrity did the public seem to forget too easily?,,1699378537.0,7398,0,0.92,7398,t5_2qh1i,r/AskReddit,43733487,False,9109,False,True,False,TheIrishninjas,t2_p7ph6,False,,False,self.AskReddit
17pyjrq,Assassin’s Creed Red To Feature First Assassin That Actually Existed,link,1699375646.0,7306,0,0.91,7306,t5_2qh03,r/gaming,38621515,False,1649,False,False,False,johanas25,t2_e3vdyndp,False,,False,insider-gaming.com
17pvff0,"1 in 8 military families with children used a food bank, pantry to make ends meet",link,1699367097.0,6847,0,0.95,6847,t5_mouw,r/science,30976813,False,356,False,False,False,universityofga,t2_2gpy0y94,False,,False,t.uga.edu
17pxqkq,"Police: Man rips off postal worker’s hijab, punches her in face in Fort Lauderdale",link,1699373443.0,6672,0,0.93,6672,t5_2qh3l,r/news,26961702,False,559,False,False,False,bullshadow,t2_af9p0,False,,False,local10.com
17pseh9,What are some good non-sexual ways to relieve horniness?,,1699357243.0,6315,0,0.91,6315,t5_2qh1i,r/AskReddit,43733487,True,1791,False,True,False,02buddha02,t2_2q3ovxti,False,,False,self.AskReddit
17q8bls,My rural county library in Kentucky has chickens,image,1699401108.0,6328,0,0.97,6328,t5_2ti4h,r/mildlyinteresting,22642836,False,273,True,False,False,cabezatuck,t2_1576qa,False,,False,i.redd.it
17psxvf,IDF forces locate and destroy Hamas terror tunnels in residential areas in Gaza,link,1699359261.0,6013,0,0.86,6013,t5_2qh13,r/worldnews,33601186,False,950,False,False,False,clarkhunterparks,t2_lnopf3ay,False,,False,ynetnews.com
17px3wj,A reunion of several of the cast members of Mallrats after 28 years,image,1699371749.0,5896,0,0.96,5896,t5_2qh0u,r/pics,30277898,False,530,False,False,False,MeenMisterMustard,t2_fqr5ddl7,False,['photography'],False,i.redd.it
17q18wi,*Someone* figured out how to open the treat container...,image,1699382709.0,5782,0,0.98,5782,t5_2qh1o,r/aww,34865404,False,120,True,False,False,soverylucky,t2_w4vzn39,False,,False,i.redd.it
17q9623,"TIL due to being a Scientologist, Kirstie Alley decided not to reprise her role as Rebecca Howe on the Cheers spinoff Frasier, because Frasier is a psychiatrist.",link,1699403520.0,6005,0,0.95,6005,t5_2qqjc,r/todayilearned,33541740,False,428,False,False,False,fap_fap_fap_fapper,t2_ig4g9,False,,False,en.wikipedia.org
17pzozn,Bf says we don’t need to use condoms anymore after his CT scan,,1699378654.0,5260,0,0.9,5260,t5_2r2jt,r/TwoXChromosomes,13632862,False,1226,False,True,False,bowloffruitypebbles,t2_olw42ppm,False,,1699402402.0,self.TwoXChromosomes
17ptpi2,What celebrity death are you surprised hasn't happened yet?,,1699361868.0,5125,0,0.86,5125,t5_2qh1i,r/AskReddit,43733487,False,8322,False,True,False,Halloween-365,t2_csgen33m,True,,False,self.AskReddit
17pwwo6,"4 charged with theft of 18-karat gold toilet named ""America""",image,1699371201.0,5021,0,0.97,5021,t5_2qh0u,r/pics,30277898,False,221,False,False,False,Eaton_snatch,t2_tzigg00o,False,['photography'],False,i.redd.it
17pqa77,This 90s gaming computer ,hosted:video,1699348236.0,4960,0,0.98,4960,t5_2tycb,r/OldSchoolCool,18306435,False,590,False,False,True,rco888,t2_tp7s2,True,,False,v.redd.it
17q0y73,"Toyota’s $10,000 Future Pickup Truck Is Basic Transportation Perfection",link,1699381958.0,4992,0,0.92,4992,t5_2t7no,r/Futurology,19314785,False,891,False,False,False,Leprechan_Sushi,t2_eliujnuq,False,,False,roadandtrack.com
17ps8zs,"Wave-powered desalination machine filters 49,000 liters of water daily",link,1699356643.0,4848,0,0.97,4848,t5_2qgzt,r/gadgets,21807996,False,220,False,False,False,diacewrb,t2_165fd3,False,,False,interestingengineering.com
17pt2pj,Hamas planting explosives in Palestinian West Bank cities,link,1699359737.0,4809,0,0.83,4809,t5_2qh13,r/worldnews,33601186,False,641,False,False,False,omega3111,t2_ttf9z,False,,False,ynetnews.com
17pucnt,"Brazil Cracks Down on Neo-Nazis: The Brazilian government has raided neo-Nazi groups across 10 states this year, part of a push by the new Lula administration to prosecute far-right extremists",link,1699363909.0,4758,0,0.97,4758,t5_2qh13,r/worldnews,33601186,False,186,False,False,False,DoremusJessup,t2_612zd,True,,False,nytimes.com
17q24c2,Israeli ambassador insists there’s no ‘humanitarian crisis’ in Gaza,link,1699385019.0,4838,0,0.85,4838,t5_2qh13,r/worldnews,33601186,False,1516,False,False,False,Little-Dog9336,t2_764fkbrp,False,,False,thehill.com
17q0087,"A star that I drew in our bathroom 10 years ago still shows up when the mirror gets foggy, even after cleaning",image,1699379477.0,4677,0,0.98,4677,t5_2ti4h,r/mildlyinteresting,22642836,False,67,True,False,False,Lil_Pask,t2_21qhp7qj,False,,False,i.redd.it
17q96l1,What's an underrated sexual experience that you think more people should try?,,1699403561.0,4767,0,0.88,4767,t5_2qh1i,r/AskReddit,43733487,True,1738,False,True,False,TheAlexaLondon,t2_m461d1ef4,False,,False,self.AskReddit
17pr646,"Before appearing in over 40 films ‘bad boy’ Nick Nolte, was given a 45-year prison sentence for selling counterfeit documents, 1980",image,1699352298.0,4266,0,0.96,4266,t5_2tycb,r/OldSchoolCool,18306435,False,278,False,False,False,eaglemaxie,t2_15p8sc,False,,False,i.redd.it
17q3r92,Guy in my city thinks he's got the new traffic cameras cracked,image,1699389307.0,4571,0,0.97,4571,t5_2qh33,r/funny,54094333,False,188,False,False,False,dob_bobbs,t2_nvvt2,False,,False,i.redd.it
17pxrky,New research shows significant brain recovery after abstinence from alcohol | The brains of those who abstained from alcohol for approximately 7.3 months exhibited significant improvements in brain structure,link,1699373517.0,4233,0,0.98,4233,t5_mouw,r/science,30976813,False,273,False,False,False,chrisdh79,t2_2uwit82z,True,,False,psypost.org
17pvaxz,i still would have watched it if it had been this way,hosted:video,1699366747.0,4247,0,0.96,4247,t5_2qh33,r/funny,54094333,False,50,False,False,True,Essie-j,t2_6zbvki7a,False,,False,v.redd.it
17q2zu3,TIL The Passion of the Christ is the highest grossing independent film ever made,link,1699387308.0,4139,0,0.92,4139,t5_2qqjc,r/todayilearned,33541740,False,734,False,False,False,do_i_no_u,t2_3ranrrm2,False,,False,en.wikipedia.org
17q3dxb,Ice cream time,hosted:video,1699388341.0,4300,0,0.99,4300,t5_2qh1o,r/aww,34865404,False,30,True,False,True,PotatoCop420,t2_3cr1vzkb,False,,False,v.redd.it
17q450q,"Restarting Baldur's Gate 3, off to a good start",image,1699390301.0,4092,0,0.97,4092,t5_2qh03,r/gaming,38621515,False,58,False,False,False,curious_zombie_,t2_dprywnfb,True,,False,i.redd.it
17pva0w,I have the joy of carrying my two fluffy companions in my bag as I bike around,image,1699366670.0,3926,0,0.99,3926,t5_2qh1o,r/aww,34865404,False,20,True,False,False,Lovely_Anna93,t2_kyj3emjwr,False,,False,i.redd.it
17puqey,"What's something that is considered ""normal"" now but won't be in 10+ years?",,1699365063.0,3653,0,0.94,3653,t5_2qh1i,r/AskReddit,43733487,False,3480,False,True,False,bronzebodyb,t2_1qogig0d,False,,False,self.AskReddit
17q51i5,Woman jailed after RentaHitman.com assassin turned out to be – surprise – FBI,link,1699392577.0,3629,0,0.97,3629,t5_2qh3l,r/news,26961702,False,375,False,False,False,sfled,t2_300gm,False,,False,theregister.com
17q77m5,What's a drug you'd never try ever again and why?,,1699398066.0,3788,0,0.94,3788,t5_2qh1i,r/AskReddit,43733487,True,5171,False,True,False,Fair_Candle979,t2_idy2sgt9o,False,,False,self.AskReddit
17pr0jt,Blooming heather this year in the Netherlands [OC] [7002x4668],image,1699351633.0,3565,0,0.98,3565,t5_2sbq3,r/EarthPorn,23644617,False,43,False,False,False,KvBarneveld,t2_5m9iloj9,False,,False,i.redd.it
17px6su,Baldur's Gate 3 fans find evidence of permadeath difficulty with only one save file,link,1699371975.0,3556,0,0.97,3556,t5_2qh03,r/gaming,38621515,False,175,False,False,False,curious_zombie_,t2_dprywnfb,True,,False,eurogamer.net
17pylyx,Who is a popular celebrity you just cannot find attractive?,,1699375811.0,3540,0,0.81,3540,t5_2qh1i,r/AskReddit,43733487,False,11012,False,True,False,Avery_5216,t2_4uu7j1zx,False,,False,self.AskReddit
17qca97,Rockstar Plans to Announce Much Anticipated ‘Grand Theft Auto VI’,link,1699412707.0,3868,0,0.91,3868,t5_2qh03,r/gaming,38621515,False,598,False,False,False,zombiesingularity,t2_8ecl2,False,,False,bloomberg.com
17pvt58,Just a normal rainy day,hosted:video,1699368180.0,3376,0,0.95,3376,t5_2qh33,r/funny,54094333,False,54,False,False,True,Redmonkeybutf,t2_rbiir51a,False,,False,v.redd.it
17q2ndq,"Gaza journalist killed alongside 42 relatives, news agency says",link,1699386397.0,3255,0,0.86,3255,t5_2qh3l,r/news,26961702,False,563,False,False,False,Faux_Real_Guise,t2_woed7,False,,False,bbc.com
17qaoqo,This is how a Chinese resteraunt labeled my daughter's sweet and sour pork,image,1699407934.0,3471,0,0.98,3471,t5_2ti4h,r/mildlyinteresting,22642836,False,62,True,False,False,TriggerHippie77,t2_46x5i,True,,False,i.redd.it
17pte2o,"Photographs from behind the scenes of ""It's a Mad, Mad, Mad, Mad World"" [which premiered 60 years ago today in 1963]",,1699360815.0,3161,0,0.98,3161,t5_2tycb,r/OldSchoolCool,18306435,False,413,False,False,False,MulciberTenebras,t2_a4220,True,,False,reddit.com
17pqi00,Aurora borealis,image,1699349302.0,3105,0,0.98,3105,t5_2qh0u,r/pics,30277898,False,55,False,False,False,algamatitl8,t2_ch6g5kmkv,False,['photography'],False,i.redd.it
17pytfr,"ELI5: my 5 year old has a book that says that Dr. Lene Hau was able to stop a beam of light. She keeps asking how she did that, I tried reading the Wikipedia article but I’m lost. Could anyone help me? I need to explain this to an actual 5 year old.",,1699376379.0,3140,0,0.93,3140,t5_2sokd,r/explainlikeimfive,22629993,False,415,False,True,False,Dr_Jerkules,t2_t54fy,False,,False,self.explainlikeimfive
17q1185,This is Weasley and Capucine adopted thru our shelter. The big boy was lonely (and really playful) so his human adopted a little sister for him. Things seems to be going great.,image,1699382175.0,3097,0,0.99,3097,t5_2qh1o,r/aww,34865404,False,24,True,False,False,sonia72quebec,t2_brdku,False,,False,i.redd.it
17pyyna,"UNHCR: ""An unimaginable humanitarian crisis is unfolding in Sudan""",,1699376728.0,3098,0,0.95,3098,t5_2qh13,r/worldnews,33601186,False,262,False,False,False,ForkShoeSpoon,t2_kh2bz1q9,False,,False,unhcr.org
17q32h7,US opposes Israeli occupation of post-conflict Gaza -White House,link,1699387493.0,3093,0,0.91,3093,t5_2qh13,r/worldnews,33601186,False,885,False,False,False,panzerfan,t2_ww44d,False,,False,reuters.com
17q394h,Indiana Woman Who Purposely Crashed Car Into Black Israelite HQ Thought It Was ‘Jewish School’: Cops,link,1699387979.0,2978,0,0.95,2978,t5_2qnts,r/nottheonion,22808274,False,257,False,False,False,gerwer,t2_ail4q,False,,False,themessenger.com
17q6a1g,The back side of the Price Is Right wheel,image,1699395663.0,2990,0,0.96,2990,t5_2qh0u,r/pics,30277898,False,160,False,False,False,NugBlazer,t2_2uvhsri7,False,['photography'],False,i.redd.it
17ptmgf,"Donuts are cake society says you can eat 24/7 but if you eat actual cake for breakfast, people will judge you",,1699361588.0,2836,0,0.85,2836,t5_2szyo,r/Showerthoughts,28771864,False,747,False,True,False,ImThe1Wh0,t2_2rmhdqz5,False,,False,self.Showerthoughts
17qbu7q,Exonerated ‘Central Park Five’ member Yusef Salaam wins New York City Council seat,link,1699411359.0,2958,0,0.97,2958,t5_2qh3l,r/news,26961702,False,54,False,False,False,Hrekires,t2_ptknpy4,False,,False,apnews.com
17pzdcr,How do I make this hood venting look better?,image,1699377816.0,2767,0,0.92,2767,t5_2qh7d,r/DIY,23023446,False,1139,False,False,False,trumpssnowflake8,t2_15jhq3ie,False,['diy_and_crafts'],False,i.redd.it
17psdxf,ELI5: Other than price is there any practical use for manual transmission for day-to-day car use?,,1699357188.0,2710,0,0.87,2710,t5_2sokd,r/explainlikeimfive,22629993,False,3074,False,True,False,PokeBattle_Fan,t2_58ra1wwu,False,,1699419340.0,self.explainlikeimfive
17pta62,Just found this little jumping spider in my house! What should I do with him? ,hosted:video,1699360446.0,2691,0,0.92,2691,t5_2qh1o,r/aww,34865404,False,476,True,False,True,S-onceto,t2_mu5trlbfl,False,,False,v.redd.it
17pwhcg,LPT: Next time you get stuck talking to someone that won’t let you go,,1699370074.0,2653,0,0.89,2653,t5_2s5oq,r/LifeProTips,22431175,False,387,False,True,False,TheGreatSickNasty,t2_4m1750ki,False,,False,self.LifeProTips
17pvnm4,"Whats the point of ""highest scores"" in gaming nowadays, if top 100 is always full of cheaters?",,1699367736.0,2644,0,0.92,2644,t5_2qh03,r/gaming,38621515,False,246,False,True,False,feicash,t2_1pvt3aeg,False,,1699383359.0,self.gaming
17q0s1s,US says Russia funds Latin America-wide anti-Ukraine disinformation drive,link,1699381512.0,2690,0,0.96,2690,t5_2qh13,r/worldnews,33601186,False,117,False,False,False,panzerfan,t2_ww44d,False,,False,reuters.com
17pydfg,"LPT: When you accidentally mess up leaving a voicemail don’t hang up, press pound or a number instead",,1699375167.0,2565,0,0.94,2565,t5_2s5oq,r/LifeProTips,22431175,False,95,False,True,False,bella_68,t2_12ve66,False,,False,self.LifeProTips
17ptk65,Coca-Cola and Nestle accused of misleading eco claims,link,1699361378.0,2550,0,0.97,2550,t5_2qh13,r/worldnews,33601186,False,78,False,False,False,greatdevonhope,t2_3y2n3khg,False,,False,bbc.co.uk
17py0sq,"TIL that the Library of Alexandria was not destroyed in a single massive fire, rather it gradually declined over several centuries",link,1699374215.0,2537,0,0.97,2537,t5_2qqjc,r/todayilearned,33541740,False,99,False,False,False,awesomedan24,t2_4drt5,False,,False,en.wikipedia.org
17pq0xh,"TIL Benito Mussolini's granddaughter Alessandra Mussolini is a former actress, singer, and model, who currently serves as a Member of the European Parliament.",link,1699347028.0,2490,0,0.94,2490,t5_2qqjc,r/todayilearned,33541740,False,240,False,False,False,Noir_Akuma,t2_pmaf8,False,,False,en.wikipedia.org
17py0ao,"Charles Dennis Buchinsky, AKA actor Charles Bronson, was also a Boeing B-29 Superfortress aerial gunner with the Guam based 61st Bombardment Squadron. He flew 25 missions and received a purple heart for wounds received in battle.",image,1699374179.0,2502,0,0.96,2502,t5_2tycb,r/OldSchoolCool,18306435,False,267,False,False,False,Stotallytob3r,t2_6wn06kim,False,,False,i.redd.it
17q6nr6,Love-fest,hosted:video,1699396623.0,2774,0,0.99,2774,t5_2qh1o,r/aww,34865404,False,33,True,False,True,irian9611,t2_noa278f,False,,False,v.redd.it
17puyzu,"First poster for ‘DAMSEL’, starring Millie Bobby Brown.",image,1699365758.0,2429,0,0.82,2429,t5_2qh3s,r/movies,31791946,False,720,False,False,False,Lonely-Freedom4986,t2_9a158xks,False,,False,i.redd.it
17prae4,A Mormon and the Irishman are on a plane,,1699352796.0,2380,0,0.95,2380,t5_2qh72,r/Jokes,27089008,True,158,False,True,False,robingrayson1008,t2_d70i0vxr,False,,False,self.Jokes
17q14r5,What is the best sex or dating advice you've ever been given?,,1699382423.0,2439,0,0.91,2439,t5_2qh1i,r/AskReddit,43733487,True,710,False,True,False,[deleted],,,,False,self.AskReddit
17pv0nr,[Homemade] Lobster Ravioli,,1699365904.0,2358,0,0.98,2358,t5_2qh55,r/food,23562998,False,43,True,False,False,ianjmcg,t2_8nti3,False,,False,reddit.com
17q6lp7,My Zeke after a bath at 8 weeks old!,image,1699396485.0,2491,0,1.0,2491,t5_2qh1o,r/aww,34865404,False,24,True,False,False,Itypewithmyeyesclose,t2_b7goh,False,,False,i.redd.it
17pqb20,Israeli refugees slam United Nations for silence,link,1699348360.0,2282,0,0.77,2282,t5_2qh13,r/worldnews,33601186,False,867,False,False,False,nahalkishon,t2_izqyutfx,False,,False,jns.org
17q1xwu,For the few italians here…this is our old school cool (1990s),image,1699384543.0,2329,0,0.96,2329,t5_2tycb,r/OldSchoolCool,18306435,False,146,False,False,False,Venus_11,t2_avffkb2y,False,,False,i.redd.it
17pvxms,"Ottawa paid nearly $670,000 for KPMG’s advice on cutting consultant costs",link,1699368547.0,2261,0,0.98,2261,t5_2qnts,r/nottheonion,22808274,False,94,False,False,False,Ilovesteelbeams,t2_yh1uf,False,,False,theglobeandmail.com
17q042w,Maxwell waddling due to cramps,hosted:video,1699379763.0,2289,0,0.92,2289,t5_2qgzy,r/sports,20853942,False,196,False,False,True,emerlander,t2_g2z9s,False,,False,v.redd.it
17q60r4,Man Has Wrong Organ Removed By Surgeons Who 'Couldn't Find' His Appendix,link,1699395006.0,2266,0,0.95,2266,t5_2qnts,r/nottheonion,22808274,False,103,False,False,False,TheMessengerNews,t2_7nku2gmjw,True,,False,themessenger.com
17q078f,"Indonesia says 200,000 hectares of palm plantations to be made forests",link,1699379997.0,2277,0,0.98,2277,t5_2qh13,r/worldnews,33601184,False,62,False,False,False,BlitzOrion,t2_obcwq98v,False,,False,reuters.com
17qbqh9,Ticket violation my dad got,image,1699411047.0,2389,0,0.96,2389,t5_2qh33,r/funny,54094333,False,141,False,False,False,Fiestabringer,t2_10ygds,False,,False,i.redd.it
17pqp2u,"Ann [O']Meara and Jerry Stiller, 1950s and 1990s",,1699350203.0,2174,0,0.99,2174,t5_2tycb,r/OldSchoolCool,18306435,False,104,False,False,False,Chaotic_Quickie_1983,t2_fh3nc7pdt,True,,False,reddit.com
17pwr1e,"An Italian guy is out picking up women in Rome. While at his favorite bar, he manages to attract one rather attractive-looking blonde.",,1699370797.0,2187,0,0.94,2187,t5_2qh72,r/Jokes,27089009,False,67,False,True,False,arztnur,t2_3y6n6h45,False,,False,self.Jokes
17q88f1,What did you see happen in the hospital waiting room?,,1699400852.0,2246,0,0.96,2246,t5_2qh1i,r/AskReddit,43733487,True,1106,False,True,False,IAmAsianHearMeRoar,t2_2u2cvidk,False,,False,self.AskReddit
17qd4ij,Rep. Rashida Tlaib censured by House over Israel-Hamas comments,link,1699415364.0,2310,0,0.92,2310,t5_2qh3l,r/news,26961702,False,1019,False,False,False,praxass,t2_89bylwb8,False,,False,abcnews.go.com
