id,title,post_hint,created_utc,ups,downs,upvote_ratio,score,subreddit_id,subreddit_name_prefixed,subreddit_subscribers,over_18,num_comments,is_original_content,is_self,is_video,author,author_fullname,author_premium,content_categories,edited,domain
17pupi4,Had to explain to a 40 year old man why choosing not to reply to men’s messages on Fetlife is not discrimination,,1699364993.0,2076,0,0.88,2076,t5_2r2jt,r/TwoXChromosomes,13632862,False,235,False,True,False,slug_face,t2_kuy3ht9s,False,,False,self.TwoXChromosomes
17q4756,"TIL The chief executive of Royal Albert Hall was furious about The Beatles lyric stating, ""the wrong-headed assumption that there are four thousand holes in our auditorium threatened to destroy its business overnight.""",,1699390464.0,2085,0,0.94,2085,t5_2qqjc,r/todayilearned,33541740,False,97,False,False,False,AKSupplyLife,t2_jrh5j5aj,False,,False,royalalberthall.com
17pxktt,"Update to my previous post: Found the gentleman again in the same spot , with another cat. Something is cooking I guess.",hosted:video,1699373005.0,2085,0,0.99,2085,t5_2qh1o,r/aww,34865404,False,14,True,False,True,Guri14,t2_15ajch,False,,False,v.redd.it
17q9ps0,Xbox’s new controller ban won’t stop cheaters using XIM - Dexerto,link,1699405100.0,2152,0,0.97,2152,t5_2qh03,r/gaming,38621515,False,151,False,False,False,fanboy_alarm,t2_5zw4ecta,False,,False,dexerto.com
17q5vmu,found my first car in the wild 3 years after i sold it,image,1699394637.0,2072,0,0.93,2072,t5_2ti4h,r/mildlyinteresting,22642836,False,111,True,False,False,idpartywthat,t2_6obg5h64,False,,False,i.imgur.com
17q3xd5,"You can have one fictional character not die how they did, who do you choose?",,1699389735.0,2063,0,0.96,2063,t5_2qh1i,r/AskReddit,43733487,True,3411,False,True,False,Toastman04,t2_6v33c,False,,False,self.AskReddit
17q3l5x,Scooby refused to get up to go outside! He was like that for over five minutes total!,hosted:video,1699388868.0,2097,0,0.99,2097,t5_2qh1o,r/aww,34865404,False,45,True,False,True,eiileenie,t2_4aygdxao,True,,False,v.redd.it
17pzdsf,44% of US job postings have salary information in them,link,1699377848.0,1994,0,0.95,1994,t5_2tk95,r/dataisbeautiful,20136022,False,170,False,False,False,counterdylan,t2_1zwlthlu,False,,False,directlyapply.com
17pts8k,A brush is the way to a cow's heart,link,1699362109.0,1984,0,0.93,1984,t5_2qt55,r/gifs,21673818,False,35,False,False,False,lnfinity,t2_4eqhs,True,,False,i.imgur.com
17q69vs,"“Judy’s Hand” Cleveland, OH",,1699395653.0,2009,0,0.97,2009,t5_2qh0u,r/pics,30277898,False,182,False,False,False,Warm-Milk-Society,t2_lhokt690r,False,['photography'],False,reddit.com
17q2jx7,Arizona man charged with threatening to execute rabbi and other Jews | CNN,link,1699386146.0,1941,0,0.94,1941,t5_2qh3l,r/news,26961702,False,274,False,False,False,Pdxduckman,t2_t5jg8,False,,False,cnn.com
17q3c02,Hospital removes children's artwork from Gaza following complaint by United Kingdom Lawyers For Israel,link,1699388198.0,1973,0,0.89,1973,t5_2qnts,r/nottheonion,22808274,False,205,False,False,False,WallabyUpstairs1496,t2_dq8sna7v,False,,False,uklfi.com
17ptnxk,[NSFW]A gay couple is on a transnational flight...,,1699361725.0,1909,0,0.91,1909,t5_2qh72,r/Jokes,27089009,True,36,False,True,False,doxmenotlmao,t2_2adeq0z9,False,,1699401268.0,self.Jokes
17q0wow,"Funkadelic, 1970s",image,1699381853.0,1860,0,0.99,1860,t5_2tycb,r/OldSchoolCool,18306435,False,68,False,False,False,bside313,t2_3y8gr5pm,False,,False,i.redd.it
17qcbua,"Democratic Gov. Andy Beshear reelected to second term in Kentucky, overcoming state's GOP dominance",link,1699412841.0,1900,0,0.97,1900,t5_2qh3l,r/news,26961702,False,52,False,False,False,prailock,t2_89yik,False,,False,apnews.com
17qd9ab,"Nathan Jones (6’11”), former Pro-WWE fighter, with his wife Fawn Tran and their child.",image,1699415820.0,2213,0,0.95,2213,t5_2qh0u,r/pics,30277898,False,274,False,False,False,Improv92,t2_8a468,False,['photography'],False,i.redd.it
17pyr5r,Hundreds of Clinics May Be Guilty of False or Misleading Claims in Ketamine Advertising,link,1699376202.0,1746,0,0.96,1746,t5_mouw,r/science,30976813,False,129,False,False,False,CUAnschutzMed,t2_77iy6ct5,False,,False,news.cuanschutz.edu
17q5tmo,TIFU by accidentally sending my gf/ex? To jail..,,1699394499.0,1795,0,0.82,1795,t5_2to41,r/tifu,18480615,False,588,False,True,False,Ihavenospecialskillz,t2_ut0c31p6,False,,False,self.tifu
17pxc0g,"Sony has announced the Alpha 9 Mark III, the world's first full-frame camera with a global shutter | It can shoot at 120 fps with no blackout and a maximum shutter speed of 1/80,000 sec.",link,1699372358.0,1743,0,0.96,1743,t5_2qgzt,r/gadgets,21807995,False,175,False,False,False,chrisdh79,t2_2uwit82z,True,,False,dpreview.com
17qaruk,A pod of orcas have sunk a yacht in the Strait of Gibraltar,link,1699408194.0,1702,0,0.98,1702,t5_2qnts,r/nottheonion,22808274,False,173,False,False,False,jstohler,t2_73qld,False,,False,npr.org
17pq5eg,"Pentagon: 38 Attacks Target US Forces in Iraq, Syria",link,1699347632.0,1549,0,0.96,1549,t5_2qh13,r/worldnews,33601184,False,240,False,False,False,Aika214,t2_trhnnadk,False,,False,voanews.com
17pwz2g,Scientists Are Researching a Device That Can Induce Lucid Dreams on Demand,link,1699371382.0,1555,0,0.94,1555,t5_2t7no,r/Futurology,19314786,False,216,False,False,False,gordonjames62,t2_cu0q6,False,,False,vice.com
17pul8v,NATO announces formal suspension of Cold War-era security treaty after Russia’s withdrawal,link,1699364638.0,1567,0,0.97,1567,t5_2qh13,r/worldnews,33601184,False,102,False,False,False,giuliomagnifico,t2_l1ket,True,,False,theglobeandmail.com
17q62x9,"Marble Canyon, Kootanay National Park, Canada (2083 × 3388)[OC]",image,1699395154.0,1590,0,0.98,1590,t5_2sbq3,r/EarthPorn,23644617,False,7,False,False,False,nickkuhnephotography,t2_psh0jjr1,False,,False,i.redd.it
17q0yvz,"Sunset at Reinebringen, Norway [OC] [3024x2268]",image,1699382007.0,1564,0,0.99,1564,t5_2sbq3,r/EarthPorn,23644617,False,6,False,False,False,maexr_,t2_2mr5ywbb,False,,False,i.redd.it
17pu7oq,First Ukrainian Armored Vehicles Reported Crossing Dnipro River,,1699363488.0,1564,0,0.97,1564,t5_2qh13,r/worldnews,33601184,False,53,False,False,False,yorkiecd,t2_krtyy,False,,False,kyivpost.com
17qe149,House approves bill slashing Pete Buttigieg's salary to $1,link,1699418565.0,1893,0,0.94,1893,t5_2qnts,r/nottheonion,22808274,False,245,False,False,False,coshiro1,t2_oxm5pj2,False,,False,foxnews.com
17q5uul,"Jewish man, 69, dies after clash during dueling protests over Israel-Palestinian conflict in LA area",link,1699394579.0,1527,0,0.82,1527,t5_2qh3l,r/news,26961702,False,454,False,False,False,AldoTheeApache,t2_oc30k,False,,False,cbsnews.com
17pqg7x,‘ChatGPT detector’ catches AI-generated papers with unprecedented accuracy. Tool based on machine learning uses features of writing style to distinguish between human and AI authors.,,1699349067.0,1490,0,0.89,1490,t5_mouw,r/science,30976813,False,389,False,False,False,the_phet,t2_4u384,False,,False,sciencedirect.com
17pswak,An Arizona golf course is under attack from a squadron of pig-like creatures,link,1699359089.0,1461,0,0.87,1461,t5_2qh3l,r/news,26961702,False,451,False,False,False,eviltwintomboy,t2_3jr3q3bm,False,,False,cnn.com
17pss35,400 hrs in this game &amp; I just discovered that Elden skeles can fly while T-posing aggressively,image,1699358658.0,1452,0,0.95,1452,t5_2qh03,r/gaming,38621515,False,57,False,False,False,Particular-Award4225,t2_n2ilw2cln,False,,False,i.redd.it
17q411b,"Bought a used book, found the original receipt from 1995",image,1699390009.0,1489,0,0.97,1489,t5_2ti4h,r/mildlyinteresting,22642836,False,75,True,False,False,lady-kl,t2_fqmpq,False,,False,i.redd.it
17q4jdy,"TIL Sally Hemings, Thomas Jefferson's enslaved underage mistress, was also his wife's half sister",link,1699391321.0,1510,0,0.92,1510,t5_2qqjc,r/todayilearned,33541740,False,236,False,False,False,supermonistic,t2_iqw5yxxzh,False,,False,latimes.com
17q19bk,‘Holy grail of shipwrecks’ to be raised along with $20bn of treasure,link,1699382742.0,1473,0,0.97,1473,t5_2qh53,r/history,17778886,False,117,False,False,False,Magister_Xehanort,t2_vwrr3,False,,False,independent.co.uk
17pw3kl,Any time i have to use a public toilet I try to make it a little fancy for the next guy. [oc],image,1699369011.0,1433,0,0.93,1433,t5_2qh33,r/funny,54094333,False,151,False,False,False,tommygunn712,t2_a5471,False,,False,i.redd.it
17q79fe,Almost every mythical creature sighting in ancient times can be explained by the fact that visually impaired people didn’t have glasses back then,,1699398192.0,1433,0,0.9,1433,t5_2szyo,r/Showerthoughts,28771864,False,113,False,True,False,GregorSD,t2_b5cvr,False,,False,self.Showerthoughts
17pvky8,Dallas police officer arrested for family violence in Irving,link,1699367527.0,1330,0,0.95,1330,t5_2qh3l,r/news,26961702,False,89,False,False,False,southernemper0r,t2_8349vwk0c,False,,False,fox4news.com
17qamgb,Research finds that gay fathers outperformed heterosexual parents in terms of parenting styles and couple relationship satisfaction,,1699407744.0,1468,0,0.78,1468,t5_mouw,r/science,30976813,False,194,False,False,False,Helen_127,t2_l8y1nvdb4,False,,False,onlinelibrary.wiley.com
17py5lo,My old man,,1699374586.0,1312,0,0.99,1312,t5_2qh1o,r/aww,34865404,False,12,True,False,False,Jacob_Marek1,t2_n27b5rga4,False,,False,reddit.com
17q8edj,Singer Johnette Napolitano of the group Concrete Blond (1990's),image,1699401324.0,1292,0,0.97,1292,t5_2tycb,r/OldSchoolCool,18306435,False,158,False,False,False,DarwinsKoala,t2_l62id3r6,False,,False,i.redd.it
17ptth9,ELI5 why London's an absolute behemoth of a city in size compared to any other British city?,,1699362212.0,1276,0,0.89,1276,t5_2sokd,r/explainlikeimfive,22629993,False,308,False,True,False,SheogorathMyBeloved,t2_n43cu6hb,False,,False,self.explainlikeimfive
17q82xw,A Union Steward goes to a brothel . . .,,1699400419.0,1302,0,0.94,1302,t5_2qh72,r/Jokes,27089009,False,62,False,True,False,4141,t2_96kyr,False,,False,self.Jokes
17q2wxj,ohioan here. had to explain to a group of men why i should have more rights than a corpse,,1699387111.0,1298,0,0.97,1298,t5_2r2jt,r/TwoXChromosomes,13632862,False,47,False,True,False,14PulsarsFromOurSun,t2_6fhd1o4o,False,,False,self.TwoXChromosomes
17psr3q,"The oral contraceptive pill might be affecting fear regulation in women’s brains | The team found the ventromedial prefrontal cortex was thinner than in men; this part of the brain is responsible for emotional regulation, such as decreasing feelings of fear in safe situations.",link,1699358564.0,1230,0,0.81,1230,t5_mouw,r/science,30976813,False,158,False,False,False,chrisdh79,t2_2uwit82z,True,,False,scimex.org
17pz2pf,Saturday Night Live cast 1992,image,1699377020.0,1208,0,0.97,1208,t5_2tycb,r/OldSchoolCool,18306435,False,183,False,False,False,BestOfSalem,t2_l5o1ki34b,False,,False,i.redd.it
17pzt01,CVS Pharmacy wants to know if I am pregnant.,,1699378942.0,1206,0,0.86,1206,t5_2r2jt,r/TwoXChromosomes,13632862,False,318,False,True,False,BuffyStark,t2_tmcod,False,,False,self.TwoXChromosomes
17pz4ms,China’s little-known system of forced Uyghur labour gives the world much of its seafood,link,1699377160.0,1240,0,0.89,1240,t5_2qh13,r/worldnews,33601184,False,118,False,False,False,CaliperLee62,t2_b5vin46k,False,,False,theglobeandmail.com
17ps0nr,"Swapping out palm oil for synthetic fats could save the world millions of tons of carbon emissions per year, according to new research.",link,1699355777.0,1184,0,0.92,1184,t5_mouw,r/science,30976813,False,128,False,False,False,molrose96,t2_33v0ohzm,False,,False,technologynetworks.com
17q02sg,TIFU by eating a lot of white chocolate,,1699379665.0,1199,0,0.94,1199,t5_2to41,r/tifu,18480615,False,123,False,True,False,Stock-Ferret-6692,t2_7ivwbhlww,False,,False,self.tifu
17pw5ae,Kauai is a clean energy leader. Its secret? A publicly owned grid,link,1699369158.0,1193,0,0.98,1193,t5_2u3ta,r/UpliftingNews,19396567,False,14,False,False,False,captainquirk,t2_33e2g,False,,False,canarymedia.com
17pq78g,"First time playing AC 2 for the story, is it just me or instant fail missions like this one when you’ve been seen by guards sucks.",image,1699347849.0,1177,0,0.82,1177,t5_2qh03,r/gaming,38621515,False,227,False,False,False,Calorie_Killer_G,t2_17bo8z,False,,False,i.redd.it
17pxrse,"TIL Somatoparaphrenia is a condition where a person denies ownership of a part of their body, usually their left arm or leg. They may claim that the limb belongs to someone else, or that it is a foreign object. They may also ignore, reject, or harm their affected limb, or try to get rid of it.",,1699373531.0,1164,0,0.97,1164,t5_2qqjc,r/todayilearned,33541740,False,80,False,False,False,Algrinder,t2_7soplvt0,False,,False,wikipedia.org
17px9pg,Glow stick broke open and stripped the stain off our kitchen table.,image,1699372196.0,1133,0,0.9,1133,t5_2qh7d,r/DIY,23023446,True,230,False,False,False,huddledtimes,t2_8cena,False,['diy_and_crafts'],False,i.redd.it
17qbpkp,"TIL of the proposed Overwhelmingly Large Telescope, whose 100m aperture would have allowed it to see objects 1500x fainter than the Hubble Telescope and analyze extrasolar planets for molecules indicating life. It was cancelled due to the €1.5 billion cost being too high",link,1699410973.0,1399,0,0.99,1399,t5_2qqjc,r/todayilearned,33541740,False,62,False,False,False,Responsible_Bit4998,t2_ce1xqwfgq,False,,False,en.wikipedia.org
17q1lbf,"LPT: Talk to your loved ones about death, their funeral and if possible; economics",,1699383634.0,1100,0,0.95,1100,t5_2s5oq,r/LifeProTips,22431175,False,88,False,True,False,Hardvig,t2_1051qu,False,,False,self.LifeProTips
17q5sxl,"TIL that the ""Q"" in Q-tips stands for ""quality.""",link,1699394455.0,1102,0,0.97,1102,t5_2qqjc,r/todayilearned,33541740,False,29,False,False,False,bringmeturtles,t2_tkrlyr6m,False,,False,qtips.com
17pyyo2,"4,000 days on, long-lived Curiosity rover keeps on ticking",link,1699376730.0,1095,0,0.98,1095,t5_2qh87,r/space,24293261,False,29,False,False,False,CrankyBear,t2_8mka8,False,,False,theregister.com
17pvdjm,Pablo Escobar (right) posing as a gangster with his cousin Gustavo in the 80s.,image,1699366944.0,1049,0,0.95,1049,t5_2tycb,r/OldSchoolCool,18306435,False,53,False,False,False,FrugalnessLungoor29,t2_rjdiell8,False,,False,i.redd.it
17q1ddy,"I'm not fat, I'm just big.",image,1699383041.0,1055,0,0.98,1055,t5_2qh1o,r/aww,34865404,False,44,True,False,False,-SaMia-,t2_tw4ieeze,False,,False,i.redd.it
17qbh65,I met a chick at the airport today who had some wild tattoos - this one was my favourite!,image,1699410278.0,1184,0,0.95,1184,t5_2qh33,r/funny,54094333,False,105,False,False,False,JoshuaDudeman,t2_8gkd41t6,False,,False,i.redd.it
17przn0,Was Ali G Indahouse (2002) Popular Outside The UK?,,1699355671.0,1005,0,0.86,1005,t5_2qh3s,r/movies,31791946,True,670,False,True,False,ZX471,t2_d76myajpp,False,,1699383346.0,self.movies
17puru8,"Meadow overlooking the Swiss Alps, Grindelwald, Switzerland [OC] [6000 X 4000]",image,1699365186.0,999,0,0.99,999,t5_2sbq3,r/EarthPorn,23644617,False,9,False,False,False,Lynchs_lens,t2_i0g5aox7k,False,,False,i.redd.it
17pw3xp,Moms for Liberty Member Demands Florida Librarians' Arrest,link,1699369044.0,984,0,0.89,984,t5_2qh4i,r/books,23220952,False,325,False,False,False,sirbruce,t2_3lty9,False,,False,miaminewtimes.com
17pv8d4,Our complex was “pumpkin’d” late last night,image,1699366530.0,974,0,0.96,974,t5_2qh33,r/funny,54094333,False,30,False,False,False,Couch_Licker,t2_h8j78,False,,False,i.redd.it
17q72u0,"TIL on November 23, 1963, former Vice President Richard Nixon wrote a condolence letter to Jackie Kennedy. On January 21, 1964, Mrs. Kennedy sent a thank you note to Nixon, encouraging him to run for the presidency again, as he had lost to Kennedy in 1960.",,1699397715.0,1006,0,0.97,1006,t5_2qqjc,r/todayilearned,33541740,False,40,False,False,False,NYY15TM,t2_esw39dg75,False,,False,nixonfoundation.org
17pude6,"Limestone tufa pillars at Mono Lake, California [2000x1000] [OC]",image,1699363973.0,959,0,0.99,959,t5_2sbq3,r/EarthPorn,23644617,False,17,False,False,False,wild-lands,t2_anl20l1p,False,,False,i.redd.it
17pxw00,One day you will buy a food item with a longer expiration date than your own....,,1699373856.0,971,0,0.91,971,t5_2szyo,r/Showerthoughts,28771864,False,100,False,True,False,kieranED,t2_om93rekk,False,,False,self.Showerthoughts
17q2yxa,"Florida man who raised thousands on GoFundMe is accused of killing husband, faking crime scene",link,1699387248.0,943,0,0.95,943,t5_2qh3l,r/news,26961702,False,45,False,False,False,OkVermicelli2557,t2_m9f3eoyd,False,,False,nbcnews.com
17q0tc6,What is one thing about a person that immediately tells you they are dirt dumb?,,1699381612.0,946,0,0.87,946,t5_2qh1i,r/AskReddit,43733487,False,1804,False,True,False,CinnamonToastFecks,t2_bvqauouj,False,,False,self.AskReddit
17qbyuo,TIL Louis Braille invented the braille system between ages 12-15 after having been blind 7 years due to an accidental self-inflicted injury at age 5 that resulted in his own blindness,,1699411761.0,1158,0,0.98,1158,t5_2qqjc,r/todayilearned,33541740,False,34,False,False,False,outoftownMD,t2_fnbzw,False,,False,icoe.org
17q2l1j,Python hunters bag one of heaviest snakes ever caught in Florida,link,1699386233.0,902,0,0.95,902,t5_2qh3l,r/news,26961702,False,129,False,False,False,bullshadow,t2_af9p0,False,,False,local10.com
17pv68v,I think DoorDash might be going overboard with their fees,image,1699366355.0,894,0,0.94,894,t5_2qh33,r/funny,54094333,False,91,False,False,False,Patriot9800,t2_5vqer,False,,False,i.redd.it
17q6myx,I live close enough to Canada that our gas pumps have these instructional stickers,image,1699396569.0,891,0,0.96,891,t5_2ti4h,r/mildlyinteresting,22642836,False,130,True,False,False,expectopatronumdmb41,t2_14zha7,False,,False,i.redd.it
17q1ohp,Official Poster for 'Terrifier 3',image,1699383851.0,861,0,0.8,861,t5_2qh3s,r/movies,31791946,True,338,False,False,False,MarvelsGrantMan136,t2_5adwlxvn,True,,False,i.redd.it
17qb49v,What’s something that new/modern gamers won’t understand?,,1699409216.0,982,0,0.93,982,t5_2qh03,r/gaming,38621515,False,1630,False,True,False,NilesDobbsS,t2_15cl3n,False,,False,self.gaming
17q4wm7,TIL: Barbra Streisand had her dog cloned twice,link,1699392234.0,866,0,0.87,866,t5_2qqjc,r/todayilearned,33541740,False,179,False,False,False,diacewrb,t2_165fd3,False,,False,bbc.co.uk
17px4dg,"First thought every morning: I’m 40, I’ll never be loved, I’ve wasted my life.",,1699371788.0,850,0,0.92,850,t5_2r2jt,r/TwoXChromosomes,13632862,False,220,False,True,False,_Sea_Lion_,t2_82nzpf8zl,False,,False,self.TwoXChromosomes
17qb62k,Arkansas man arrested after child is found in closet hideaway that was nailed shut,link,1699409363.0,849,0,0.98,849,t5_2qh3l,r/news,26961702,False,40,False,False,False,MrsFinger,t2_d6hqx,False,,False,nbcnews.com
17psd87,Putin's Spies Expelled by West Bemoan Lack of Jobs in Russia,link,1699357105.0,812,0,0.97,812,t5_2qh13,r/worldnews,33601184,False,51,False,False,False,antrophist,t2_4np8dzo6,False,,False,newsweek.com
17pv4o8,"Turkey's parliament boycotts Coca-Cola, Nestle from menu over alleged support for Israel",link,1699366226.0,811,0,0.9,811,t5_2qh13,r/worldnews,33601184,False,119,False,False,False,Georgeika,t2_18opl1,False,,False,livemint.com
17q645w,"Nintendo: ""Development of a Live-Action Film of The Legend of Zelda to Start"" (Nov. 8, 2023)",link,1699395248.0,789,0,0.93,789,t5_2qh03,r/gaming,38621515,False,236,False,False,False,Xanek,t2_6qrlr,False,,False,nintendo.co.jp
17pthl9,Pfizer to Lay Off 781 Workers in New Jersey,,1699361145.0,767,0,0.94,767,t5_2qh3l,r/news,26961702,False,104,False,False,False,margincall-mario,t2_i2ripo38,False,,False,wsj.com
17q3v5h,"Up to 50,000 Roman coins discovered off coast of Sardinia",link,1699389578.0,771,0,0.98,771,t5_2qh3l,r/news,26961702,False,57,False,False,False,italiarsenal,t2_7kl29f1w,False,,False,theguardian.com
17pymsx,Yeah the needler was cool... but this thing... this was something else. Cerebral Bore from Turok 2,image,1699375870.0,773,0,0.95,773,t5_2qh03,r/gaming,38621515,False,71,False,False,False,Dirly,t2_3zejf,False,,False,i.redd.it
17qc4bs,Those cars didn’t stand a chance,hosted:video,1699412225.0,902,0,0.93,902,t5_2qh33,r/funny,54094333,False,41,False,False,True,hossaburton,t2_12l4rsnq,False,,False,v.redd.it
17pxymq,Bedouin family offers $1 million for info on terrorist who killed son,,1699374056.0,770,0,0.89,770,t5_2qh3l,r/news,26961702,True,137,False,False,False,XpzXp,t2_rl6a0,False,,False,m.jpost.com
17pvtkn,Brittany Murphy ( 1997 ),image,1699368218.0,767,0,0.96,767,t5_2tycb,r/OldSchoolCool,18306435,False,44,False,False,False,amartyamishraaa,t2_kbqq70pij,False,,False,i.redd.it
17q48ur,New bill aims to ban denialists from running for office,link,1699390592.0,804,0,0.95,804,t5_2qh13,r/worldnews,33601184,False,21,False,False,False,hernannadal,t2_laze,False,,False,buenosairesherald.com
17q29lm,US sanctions Mexican Sinaloa cartel members and firms over fentanyl trafficking,link,1699385413.0,752,0,0.97,752,t5_2qh3l,r/news,26961702,False,67,False,False,False,AudibleNod,t2_evw04,True,,False,abcnews.go.com
17pzxy4,"LPT: Have two duvets, one for you and one for your partner.",,1699379306.0,771,0,0.86,771,t5_2s5oq,r/LifeProTips,22431175,False,153,False,True,False,eyesbiggerthanbelly,t2_4ndp0o7u,False,,1699428460.0,self.LifeProTips
