data-product-id,data-product-name,data-product-type,data-product-on-offer,data-product-index,image-url,product-page,product-name,product-size,item-price,price-per-unit,offer-description,category
497633,Finish Quantum All in One Lemon Dishwasher Tablets,G,true,132,https://ecom-su-static-prod.wtrecom.com/images/products/3/LN_497633_BP_3.jpg,https://www.waitrose.com/ecom/products/finish-quantum-all-in-one-lemon-dishwasher-tablets/497633-778256-778257,Finish Quantum All in One Lemon Dishwasher Tablets,64Each,£10.00,15.6p each,Save 1/3. Was £15.00,Household
627645,Finish Ultimate Plus All in One Lemon Dishwasher Tablets Large Pack,G,true,277,https://ecom-su-static-prod.wtrecom.com/images/products/3/LN_627645_BP_3.jpg,https://www.waitrose.com/ecom/products/finish-ultimate-plus-all-in-one-lemon-dishwasher-tablets-large-pack/627645-803194-803195,Finish Ultimate Plus All in One Lemon Dishwasher Tablets Large Pack,48Each,£9.00,18.8p each,save £6.50. Was £15.50,Household
475915,Finish Ultimate All in One Lemon Dishwasher Tablets,G,true,230,https://ecom-su-static-prod.wtrecom.com/images/products/3/LN_475915_BP_3.jpg,https://www.waitrose.com/ecom/products/finish-ultimate-all-in-one-lemon-dishwasher-tablets/475915-720137-720138,Finish Ultimate All in One Lemon Dishwasher Tablets,36s,£8.00,22.2p each,Save 1/3. Was £12.50,Household
028863,Essential White Ultra Soft Bathroom Tissue,G,false,4,https://ecom-su-static-prod.wtrecom.com/images/products/3/LN_028863_BP_3.jpg,https://www.waitrose.com/ecom/products/essential-white-ultra-soft-bathroom-tissue/028863-14063-14064,Essential White Ultra Soft Bathroom Tissue,9x190 sheets,£4.00,23.4p/100 sheets,,Household
022482,Essential Thick Bleach Citrus,G,false,5,https://ecom-su-static-prod.wtrecom.com/images/products/3/LN_022482_BP_3.jpg,https://www.waitrose.com/ecom/products/essential-thick-bleach-citrus/022482-10960-10961,Essential Thick Bleach Citrus,750ml,75p,£1/litre,,Household
879894,essential Waitrose Soft White Tissues,G,false,6,https://ecom-su-static-prod.wtrecom.com/images/products/3/LN_879894_BP_3.jpg,https://www.waitrose.com/ecom/products/essential-waitrose-soft-white-tissues/879894-287831-287832,essential Waitrose Soft White Tissues,96 sheets,£1.40,14.6p/10 sheets,,Household
616207,Essential 2 Extra Length Kitchen Rolls,G,false,7,https://ecom-su-static-prod.wtrecom.com/images/products/3/LN_616207_BP_3.jpg,https://www.waitrose.com/ecom/products/essential-2-extra-length-kitchen-rolls/616207-698054-698055,Essential 2 Extra Length Kitchen Rolls,2x100 sheets,£2.70,£1.35/100 sheets,,Household
014407,Andrex Supreme Quilts Toilet Roll,G,true,8,https://ecom-su-static-prod.wtrecom.com/images/products/3/LN_014407_BP_3.jpg,https://www.waitrose.com/ecom/products/andrex-supreme-quilts-toilet-roll/014407-6924-6925,Andrex Supreme Quilts Toilet Roll,9x155 sheets,£7.10,50.9p/100 sheets,Add 2 for £10,Household
071469,Andrex Classic Clean Toilet Roll,G,true,9,https://ecom-su-static-prod.wtrecom.com/images/products/3/LN_071469_BP_3.jpg,https://www.waitrose.com/ecom/products/andrex-classic-clean-toilet-roll/071469-36254-36255,Andrex Classic Clean Toilet Roll,9x190 sheets,£4.95,28.9p/100 sheets,save £1.65. Was £6.60,Household
003521,Essential Aluminium Foil 10m x 300mm,G,false,10,https://ecom-su-static-prod.wtrecom.com/images/products/3/LN_003521_BP_3.jpg,https://www.waitrose.com/ecom/products/essential-aluminium-foil-10m-x-300mm/003521-1413-1414,Essential Aluminium Foil 10m x 300mm,Each,£1.50,£1.50 each,,Household
760378,Essential Kitchen Rolls,G,false,11,https://ecom-su-static-prod.wtrecom.com/images/products/3/LN_760378_BP_3.jpg,https://www.waitrose.com/ecom/products/essential-kitchen-rolls/760378-698132-698133,Essential Kitchen Rolls,4x100 sheets,£4.30,£1.08/100 sheets,,Household
032584,Domestos Thick Bleach Original Toilet Cleaner,G,false,12,https://ecom-su-static-prod.wtrecom.com/images/products/3/LN_032584_BP_3.jpg,https://www.waitrose.com/ecom/products/domestos-thick-bleach-original-toilet-cleaner/032584-15927-15928,Domestos Thick Bleach Original Toilet Cleaner,750ml,£1.60,£2.14/litre,,Household
681764,Regina Blitz 3 Ply Towels,G,false,13,https://ecom-su-static-prod.wtrecom.com/images/products/3/LN_681764_BP_3.jpg,https://www.waitrose.com/ecom/products/regina-blitz-3-ply-towels/681764-268170-268171,Regina Blitz 3 Ply Towels,2x70 sheets,£5.25,£3.75/100 sheets,,Household
003551,Essential Thick Bleach,G,false,14,https://ecom-su-static-prod.wtrecom.com/images/products/3/LN_003551_BP_3.jpg,https://www.waitrose.com/ecom/products/essential-thick-bleach/003551-1445-1446,Essential Thick Bleach,750ml,75p,£1/litre,,Household
851002,Kleenex Collection Tissues Cube,G,false,15,https://ecom-su-static-prod.wtrecom.com/images/products/3/LN_851002_BP_3.jpg,https://www.waitrose.com/ecom/products/kleenex-collection-tissues-cube/851002-759780-759781,Kleenex Collection Tissues Cube,48 Sheets,£1.45,30.2p/10 sheets,,Household
726503,Andrex Supreme Quilts Toilet Roll Family Pack,G,false,16,https://ecom-su-static-prod.wtrecom.com/images/products/3/LN_726503_BP_3.jpg,https://www.waitrose.com/ecom/products/andrex-supreme-quilts-toilet-roll-family-pack/726503-298617-298618,Andrex Supreme Quilts Toilet Roll Family Pack,16x155 sheets,£12.35,49.8p/100 sheets,,Household
502548,Kleenex Extra Large Tissues Twin Pack,G,false,17,https://ecom-su-static-prod.wtrecom.com/images/products/3/LN_502548_BP_3.jpg,https://www.waitrose.com/ecom/products/kleenex-extra-large-tissues-twin-pack/502548-70996-70997,Kleenex Extra Large Tissues Twin Pack,2x44 sheets,£2.65,30.1p/10 sheets,,Household
669732,Plenty The Original One,G,false,18,https://ecom-su-static-prod.wtrecom.com/images/products/3/LN_669732_BP_3.jpg,https://www.waitrose.com/ecom/products/plenty-the-original-one/669732-596437-596438,Plenty The Original One,2x100 sheets,£6.00,£3/100 sheets,,Household
071623,Andrex Classic Clean Flushable Washlets Moist Toilet Tissue Wipes,G,true,19,https://ecom-su-static-prod.wtrecom.com/images/products/3/LN_071623_BP_3.jpg,https://www.waitrose.com/ecom/products/andrex-classic-clean-flushable-washlets-moist-toilet-tissue-wipes/071623-36354-36355,Andrex Classic Clean Flushable Washlets Moist Toilet Tissue Wipes,36 sheets,£1.50,£4.17/100 sheets,Add 2 for £2,Household
434365,Waitrose 20 Compostable Caddy Liners,G,false,20,https://ecom-su-static-prod.wtrecom.com/images/products/3/LN_434365_BP_3.jpg,https://www.waitrose.com/ecom/products/waitrose-20-compostable-caddy-liners/434365-136285-136286,Waitrose 20 Compostable Caddy Liners,20s,£2.25,11.3p each,,Household
670629,Essential White Ultra Soft Bathroom Tissue,G,false,21,https://ecom-su-static-prod.wtrecom.com/images/products/3/LN_670629_BP_3.jpg,https://www.waitrose.com/ecom/products/essential-white-ultra-soft-bathroom-tissue/670629-95217-95218,Essential White Ultra Soft Bathroom Tissue,16x190 sheets,£7.00,23p/100 sheets,,Household
092324,Kleenex Ultra Soft Tissues Mega Box,G,true,22,https://ecom-su-static-prod.wtrecom.com/images/products/3/LN_092324_BP_3.jpg,https://www.waitrose.com/ecom/products/kleenex-ultra-soft-tissues-mega-box/092324-47497-47498,Kleenex Ultra Soft Tissues Mega Box,112 sheets,£4.20,£3.75/100 sheets,Add 2 for £5,Household
593936,Fairy Original Washing Up Liquid,G,false,23,https://ecom-su-static-prod.wtrecom.com/images/products/3/LN_593936_BP_3.jpg,https://www.waitrose.com/ecom/products/fairy-original-washing-up-liquid/593936-84197-84198,Fairy Original Washing Up Liquid,320ml,£1.25,39.1p/100ml,,Household
013687,Essential Thick Bleach Aqua,G,false,24,https://ecom-su-static-prod.wtrecom.com/images/products/3/LN_013687_BP_3.jpg,https://www.waitrose.com/ecom/products/essential-thick-bleach-aqua/013687-6649-6650,Essential Thick Bleach Aqua,750ml,75p,£1/litre,,Household
522601,Essential Pedal Bin Liners Tie Handles,G,false,25,https://ecom-su-static-prod.wtrecom.com/images/products/3/LN_522601_BP_3.jpg,https://www.waitrose.com/ecom/products/essential-pedal-bin-liners-tie-handles/522601-156201-156202,,,,,,Household
522601,Essential Pedal Bin Liners Tie Handles,G,false,25,https://ecom-su-static-prod.wtrecom.com/images/products/3/LN_522601_BP_3.jpg,https://www.waitrose.com/ecom/products/essential-pedal-bin-liners-tie-handles/522601-156201-156202,Essential Pedal Bin Liners Tie Handles,30s,£2.35,7.8p each,,Household
070464,Essential White Ultra Soft Bathroom Tissue,G,false,26,https://ecom-su-static-prod.wtrecom.com/images/products/3/LN_070464_BP_3.jpg,https://www.waitrose.com/ecom/products/essential-white-ultra-soft-bathroom-tissue/070464-35691-35692,Essential White Ultra Soft Bathroom Tissue,4x190Sheet,£2.00,26.3p/100 sheets,,Household
096180,Kleenex Balsam Tissues Mega Box,G,true,27,https://ecom-su-static-prod.wtrecom.com/images/products/3/LN_096180_BP_3.jpg,https://www.waitrose.com/ecom/products/kleenex-balsam-tissues-mega-box/096180-49220-49221,Kleenex Balsam Tissues Mega Box,112 Sheets,£4.20,£3.75/100 sheets,Add 2 for £5,Household
787688,Essential Washing Up Liquid Citrus,G,false,28,https://ecom-su-static-prod.wtrecom.com/images/products/3/LN_787688_BP_3.jpg,https://www.waitrose.com/ecom/products/essential-washing-up-liquid-citrus/787688-803228-803229,Essential Washing Up Liquid Citrus,500ml,70p,£1.40/litre,,Household
572199,Waitrose Tie Handle Refuse Bags,G,false,29,https://ecom-su-static-prod.wtrecom.com/images/products/3/LN_572199_BP_3.jpg,https://www.waitrose.com/ecom/products/waitrose-tie-handle-refuse-bags/572199-795094-795095,Waitrose Tie Handle Refuse Bags,20s,£2.95,14.8p each,,Household
661336,Fairy Original Lemon Washing Up Liquid,G,true,30,https://ecom-su-static-prod.wtrecom.com/images/products/3/LN_661336_BP_3.jpg,https://www.waitrose.com/ecom/products/fairy-original-lemon-washing-up-liquid/661336-93890-93891,Fairy Original Lemon Washing Up Liquid,320ml,£1.00,31.3p/100ml,20% Off. Was £1.25,Household
661429,Waitrose ECO Kitchen Towels White,G,false,31,https://ecom-su-static-prod.wtrecom.com/images/products/3/LN_661429_BP_3.jpg,https://www.waitrose.com/ecom/products/waitrose-eco-kitchen-towels-white/661429-280751-280752,Waitrose ECO Kitchen Towels White,2x100 sheets,£2.70,£1.35/100 sheets,,Household
078768,Waitrose Ultra Soft White Tissues,G,false,32,https://ecom-su-static-prod.wtrecom.com/images/products/3/LN_078768_BP_3.jpg,https://www.waitrose.com/ecom/products/waitrose-ultra-soft-white-tissues/078768-40105-40106,Waitrose Ultra Soft White Tissues,56 sheets,£1.30,23.2p/10 sheets,,Household
474089,Plenty The Original One,G,true,33,https://ecom-su-static-prod.wtrecom.com/images/products/3/LN_474089_BP_3.jpg,https://www.waitrose.com/ecom/products/plenty-the-original-one/474089-596429-596430,Plenty The Original One,4x100 sheets,£6.25,£1.57/100 sheets,save £2.95. Was £9.20,Household
562191,Harpic Bleach White & Shine Toilet Cleaner Citrus,G,true,34,https://ecom-su-static-prod.wtrecom.com/images/products/3/LN_562191_BP_3.jpg,https://www.waitrose.com/ecom/products/harpic-bleach-white-shine-toilet-cleaner-citrus/562191-255551-255552,Harpic Bleach White & Shine Toilet Cleaner Citrus,750ml,£1.60,£2.14/litre,Add 2 for £2.50,Household
738361,Essential White Ultra Soft Bathroom Tissue,G,false,35,https://ecom-su-static-prod.wtrecom.com/images/products/3/LN_738361_BP_3.jpg,https://www.waitrose.com/ecom/products/essential-white-ultra-soft-bathroom-tissue/738361-759720-759721,Essential White Ultra Soft Bathroom Tissue,24 x 190 sheets,£9.50,20.8p/100 sheets,,Household
384509,Regina Blitz 1 Roll,G,true,36,https://ecom-su-static-prod.wtrecom.com/images/products/3/LN_384509_BP_3.jpg,https://www.waitrose.com/ecom/products/regina-blitz-1-roll/384509-54069-54070,Regina Blitz 1 Roll,100 sheets,£2.50,£2.50/100 sheets,save £1.30. Was £3.80,Household
071559,Essential Large Soft White Tissues,G,false,37,https://ecom-su-static-prod.wtrecom.com/images/products/3/LN_071559_BP_3.jpg,https://www.waitrose.com/ecom/products/essential-large-soft-white-tissues/071559-36312-36313,Essential Large Soft White Tissues,100 sheets,£1.90,19p/10 sheets,,Household
059699,"Waitrose Cashmere Bathroom Tissue, Chamomile",G,false,38,https://ecom-su-static-prod.wtrecom.com/images/products/3/LN_059699_BP_3.jpg,https://www.waitrose.com/ecom/products/waitrose-cashmere-bathroom-tissue-chamomile/059699-428538-30110,"Waitrose Cashmere Bathroom Tissue, Chamomile",9x170 sheets,£5.50,35.9p/100 sheets,,Household
073921,Domestos Thick Bleach Citrus Toilet Cleaner,G,false,39,https://ecom-su-static-prod.wtrecom.com/images/products/3/LN_073921_BP_3.jpg,https://www.waitrose.com/ecom/products/domestos-thick-bleach-citrus-toilet-cleaner/073921-37516-37517,Domestos Thick Bleach Citrus Toilet Cleaner,750ml,£1.60,£2.14/litre,,Household
883134,Essential Floor Wipes,G,false,40,https://ecom-su-static-prod.wtrecom.com/images/products/3/LN_883134_BP_3.jpg,https://www.waitrose.com/ecom/products/essential-floor-wipes/883134-366641-366642,Essential Floor Wipes,15s,£1.10,7.3p each,,Household
756054,Waitrose Ultra Strong Kitchen Towel,G,false,41,https://ecom-su-static-prod.wtrecom.com/images/products/3/LN_756054_BP_3.jpg,https://www.waitrose.com/ecom/products/waitrose-ultra-strong-kitchen-towel/756054-760747-760748,Waitrose Ultra Strong Kitchen Towel,2x100sheets,£3.20,£1.60/100 sheets,,Household
758598,Persil Non Bio Washing Liquid Detergent 53W,G,false,42,https://ecom-su-static-prod.wtrecom.com/images/products/3/LN_758598_BP_3.jpg,https://www.waitrose.com/ecom/products/persil-non-bio-washing-liquid-detergent-53w/758598-162205-162206,Persil Non Bio Washing Liquid Detergent 53W,1.431litre,£9.50,£6.64/litre,,Household
515703,Waitrose Swing Bin Liners,G,false,43,https://ecom-su-static-prod.wtrecom.com/images/products/3/LN_515703_BP_3.jpg,https://www.waitrose.com/ecom/products/waitrose-swing-bin-liners/515703-795070-795071,Waitrose Swing Bin Liners,20s,£2.25,11.3p each,,Household
074674,Harpic Limescale Remover Toilet Cleaner Gel Original,G,true,44,https://ecom-su-static-prod.wtrecom.com/images/products/3/LN_074674_BP_3.jpg,https://www.waitrose.com/ecom/products/harpic-limescale-remover-toilet-cleaner-gel-original/074674-37892-37893,Harpic Limescale Remover Toilet Cleaner Gel Original,750ml,£2.00,£2.67/litre,Add 2 for £3,Household
765446,Fairy Original Washing Up Liquid,G,true,45,https://ecom-su-static-prod.wtrecom.com/images/products/3/LN_765446_BP_3.jpg,https://www.waitrose.com/ecom/products/fairy-original-washing-up-liquid/765446-785790-785791,Fairy Original Washing Up Liquid,654ml,£2.00,£3.06/litre,20% Off. Was £2.50,Household
002490,Viakal Limescale Remover Spray,G,false,46,https://ecom-su-static-prod.wtrecom.com/images/products/3/LN_002490_BP_3.jpg,https://www.waitrose.com/ecom/products/viakal-limescale-remover-spray/002490-830-831,Viakal Limescale Remover Spray,500ml,£4.00,£8/litre,,Household
778748,Dettol Anti-Bac Biodegradable Surface Wipes,G,false,47,https://ecom-su-static-prod.wtrecom.com/images/products/3/LN_778748_BP_3.jpg,https://www.waitrose.com/ecom/products/dettol-anti-bac-biodegradable-surface-wipes/778748-110795-110796,Dettol Anti-Bac Biodegradable Surface Wipes,72s,£3.75,5.2p each,,Household
044985,Waitrose Soft Pocket Tissues,G,false,48,https://ecom-su-static-prod.wtrecom.com/images/products/3/LN_044985_BP_3.jpg,https://www.waitrose.com/ecom/products/waitrose-soft-pocket-tissues/044985-22200-22201,Waitrose Soft Pocket Tissues,10x10 sheets,£1.50,15p/10 sheets,,Household
502043,Crystale Dish Salt Box,G,false,49,https://ecom-su-static-prod.wtrecom.com/images/products/3/LN_502043_BP_3.jpg,https://www.waitrose.com/ecom/products/crystale-dish-salt-box/502043-794684-794685,Crystale Dish Salt Box,2Kg,£2.65,£1.33/kg,,Household
839952,Essential Non-Scratch Scourers,G,false,50,https://ecom-su-static-prod.wtrecom.com/images/products/3/LN_839952_BP_3.jpg,https://www.waitrose.com/ecom/products/essential-non-scratch-scourers/839952-230049-230050,Essential Non-Scratch Scourers,6s,£1.10,18.3p each,,Household
761759,Spontex Washups Sponge Scourers,G,false,51,https://ecom-su-static-prod.wtrecom.com/images/products/3/LN_761759_BP_3.jpg,https://www.waitrose.com/ecom/products/spontex-washups-sponge-scourers/761759-483677-483678,Spontex Washups Sponge Scourers,4s,£1.60,40p each,,Household
692678,Harpic Bleach White & Shine Toilet Cleaner Original,G,true,52,https://ecom-su-static-prod.wtrecom.com/images/products/3/LN_692678_BP_3.jpg,https://www.waitrose.com/ecom/products/harpic-bleach-white-shine-toilet-cleaner-original/692678-255593-255594,Harpic Bleach White & Shine Toilet Cleaner Original,750ml,£1.60,£2.14/litre,Add 2 for £2.50,Household
447392,Essential Multi Surface Wipes,G,false,53,https://ecom-su-static-prod.wtrecom.com/images/products/3/LN_447392_BP_3.jpg,https://www.waitrose.com/ecom/products/essential-multi-surface-wipes/447392-720119-720120,Essential Multi Surface Wipes,72s,£1.80,2.5p each,,Household
017941,Cif Cream Multi-Purpose Cleaner Lemon Fresh,G,false,54,https://ecom-su-static-prod.wtrecom.com/images/products/3/LN_017941_BP_3.jpg,https://www.waitrose.com/ecom/products/cif-cream-multi-purpose-cleaner-lemon-fresh/017941-8696-8697,Cif Cream Multi-Purpose Cleaner Lemon Fresh,500ml,£1.60,£3.20/litre,,Household
410436,Dettol Anti-Bac Surface Cleanser Spray,G,false,55,https://ecom-su-static-prod.wtrecom.com/images/products/3/LN_410436_BP_3.jpg,https://www.waitrose.com/ecom/products/dettol-anti-bac-surface-cleanser-spray/410436-526412-526413,Dettol Anti-Bac Surface Cleanser Spray,750ml,£2.50,£3.34/litre,,Household
880433,Kleenex Antibacterial Wipes 12s,G,true,56,https://ecom-su-static-prod.wtrecom.com/images/products/3/LN_880433_BP_3.jpg,https://www.waitrose.com/ecom/products/kleenex-antibacterial-wipes-12s/880433-688762-688763,Kleenex Antibacterial Wipes 12s,12 sheets,£1.00,83.3p/10 sheets,Add 2 for £1.50,Household
633698,Essential Medium Tie Handle Bags,G,false,57,https://ecom-su-static-prod.wtrecom.com/images/products/3/LN_633698_BP_3.jpg,https://www.waitrose.com/ecom/products/essential-medium-tie-handle-bags/633698-726398-726399,Essential Medium Tie Handle Bags,40s,£2.00,5p each,,Household
691007,Waitrose ECO Kitchen Towel 100% Recycled,G,false,58,https://ecom-su-static-prod.wtrecom.com/images/products/3/LN_691007_BP_3.jpg,https://www.waitrose.com/ecom/products/waitrose-eco-kitchen-towel-100-recycled/691007-280753-280754,Waitrose ECO Kitchen Towel 100% Recycled,4x100Sheet,£4.80,£1.20/100 sheets,,Household
395109,Waitrose Ultra Soft White Tissues,G,false,59,https://ecom-su-static-prod.wtrecom.com/images/products/3/LN_395109_BP_3.jpg,https://www.waitrose.com/ecom/products/waitrose-ultra-soft-white-tissues/395109-287661-287662,Waitrose Ultra Soft White Tissues,80 sheets,£1.75,21.9p/10 sheets,,Household
081529,Waitrose Large Refuse Sacks Tie Handles,G,false,60,https://ecom-su-static-prod.wtrecom.com/images/products/3/LN_081529_BP_3.jpg,https://www.waitrose.com/ecom/products/waitrose-large-refuse-sacks-tie-handles/081529-41487-41488,Waitrose Large Refuse Sacks Tie Handles,15s,£4.40,29.3p each,,Household
633350,Waitrose Lavender Scented Vanity Bin Liners 10L,G,false,61,https://ecom-su-static-prod.wtrecom.com/images/products/3/LN_633350_BP_3.jpg,https://www.waitrose.com/ecom/products/waitrose-lavender-scented-vanity-bin-liners-10l/633350-795110-795111,Waitrose Lavender Scented Vanity Bin Liners 10L,25s,£1.79,7.2p each,,Household
070108,Marigold Extra-Life Medium Kitchen Gloves,G,true,62,https://ecom-su-static-prod.wtrecom.com/images/products/3/LN_070108_BP_3.jpg,https://www.waitrose.com/ecom/products/marigold-extra-life-medium-kitchen-gloves/070108-35512-35513,Marigold Extra-Life Medium Kitchen Gloves,pair,£2.60,£2.60 each,20% Off. Was £3.25,Household
441959,Fairy Lime & Lemongrass Washing Up Liquid,G,false,63,https://ecom-su-static-prod.wtrecom.com/images/products/3/LN_441959_BP_3.jpg,https://www.waitrose.com/ecom/products/fairy-lime-lemongrass-washing-up-liquid/441959-62200-62201,Fairy Lime & Lemongrass Washing Up Liquid,383ml,£2.00,£5.23/litre,,Household
856065,Fairy Platinum Quick Wash Original Liquid,G,false,64,https://ecom-su-static-prod.wtrecom.com/images/products/3/LN_856065_BP_3.jpg,https://www.waitrose.com/ecom/products/fairy-platinum-quick-wash-original-liquid/856065-785842-785843,Fairy Platinum Quick Wash Original Liquid,520ml,£3.00,£5.77/litre,,Household
052975,Andrex Supreme Quilts Toilet Roll Small Pack,G,true,65,https://ecom-su-static-prod.wtrecom.com/images/products/3/LN_052975_BP_3.jpg,https://www.waitrose.com/ecom/products/andrex-supreme-quilts-toilet-roll-small-pack/052975-26432-26433,Andrex Supreme Quilts Toilet Roll Small Pack,4x155 sheets,£2.85,46p/100 sheets,save 65p. Was £3.50,Household
497636,Crystale Dishwasher Salt,G,false,66,https://ecom-su-static-prod.wtrecom.com/images/products/3/LN_497636_BP_3.jpg,https://www.waitrose.com/ecom/products/crystale-dishwasher-salt/497636-778258-778259,Crystale Dishwasher Salt,900g,£1.50,£1.67/kg,,Household
374481,Harpic Powerplus Toilet Cleaner Citrus,G,true,67,https://ecom-su-static-prod.wtrecom.com/images/products/3/LN_374481_BP_3.jpg,https://www.waitrose.com/ecom/products/harpic-powerplus-toilet-cleaner-citrus/374481-52687-52688,Harpic Powerplus Toilet Cleaner Citrus,750ml,£2.10,£2.80/litre,Add 2 for £3,Household
751795,Waitrose Flush Top Refuse Bags,G,false,68,https://ecom-su-static-prod.wtrecom.com/images/products/3/LN_751795_BP_3.jpg,https://www.waitrose.com/ecom/products/waitrose-flush-top-refuse-bags/751795-803476-803477,Waitrose Flush Top Refuse Bags,20s,£2.50,12.5p each,,Household
728497,Essential Washing Up Liquid Orginal,G,false,69,https://ecom-su-static-prod.wtrecom.com/images/products/3/LN_728497_BP_3.jpg,https://www.waitrose.com/ecom/products/essential-washing-up-liquid-orginal/728497-803222-803223,Essential Washing Up Liquid Orginal,500ml,70p,£1.40/litre,,Household
006270,Waitrose Aluminium Foil,G,false,70,https://ecom-su-static-prod.wtrecom.com/images/products/3/LN_006270_BP_3.jpg,https://www.waitrose.com/ecom/products/waitrose-aluminium-foil/006270-2780-2781,Waitrose Aluminium Foil,Each,£3.60,£3.60 each,,Household
686396,Waitrose Moist Toilet Tissue Refill Chamomile,G,false,71,https://ecom-su-static-prod.wtrecom.com/images/products/3/LN_686396_BP_3.jpg,https://www.waitrose.com/ecom/products/waitrose-moist-toilet-tissue-refill-chamomile/686396-97491-97492,Waitrose Moist Toilet Tissue Refill Chamomile,42 sheets,£1.20,£2.86/100 sheets,,Household
804689,Finish Dishwasher Cleaner 250ml Lemon,G,false,72,https://ecom-su-static-prod.wtrecom.com/images/products/3/LN_804689_BP_3.jpg,https://www.waitrose.com/ecom/products/finish-dishwasher-cleaner-250ml-lemon/804689-329038-329039,Finish Dishwasher Cleaner 250ml Lemon,250ml,£4.95,£1.98/100ml,,Household
618692,Finish Ultimate All in One Lemon Dishwasher Tablets Large Pack,G,false,73,https://ecom-su-static-prod.wtrecom.com/images/products/3/LN_618692_BP_3.jpg,https://www.waitrose.com/ecom/products/finish-ultimate-all-in-one-lemon-dishwasher-tablets-large-pack/618692-720209-720210,Finish Ultimate All in One Lemon Dishwasher Tablets Large Pack,55Each,£15.00,27.3p each,,Household
053904,Essential Thick Bleach,G,false,74,https://ecom-su-static-prod.wtrecom.com/images/products/3/LN_053904_BP_3.jpg,https://www.waitrose.com/ecom/products/essential-thick-bleach/053904-27018-27019,Essential Thick Bleach,2litre,£1.35,67.5p/litre,,Household
607805,Flash All Purpose Floor Cleaner,G,false,75,https://ecom-su-static-prod.wtrecom.com/images/products/3/LN_607805_BP_3.jpg,https://www.waitrose.com/ecom/products/flash-all-purpose-floor-cleaner/607805-803336-803337,Flash All Purpose Floor Cleaner,950ml,£2.50,£2.64/litre,,Household
069202,Essential Dishwasher Rinse Aid Lemon,G,false,76,https://ecom-su-static-prod.wtrecom.com/images/products/3/LN_069202_BP_3.jpg,https://www.waitrose.com/ecom/products/essential-dishwasher-rinse-aid-lemon/069202-35091-35092,Essential Dishwasher Rinse Aid Lemon,500ml,£2.85,57p/100ml,,Household
036953,Comfort Pure Fabric Conditioner for sensitive skin,G,false,77,https://ecom-su-static-prod.wtrecom.com/images/products/3/LN_036953_BP_3.jpg,https://www.waitrose.com/ecom/products/comfort-pure-fabric-conditioner-for-sensitive-skin/036953-18497-18498,Comfort Pure Fabric Conditioner for sensitive skin,990ml,£3.00,£3.04/litre,,Household
813324,Finish Power All in One Lemon Dishwasher Tablets,G,false,78,https://ecom-su-static-prod.wtrecom.com/images/products/3/LN_813324_BP_3.jpg,https://www.waitrose.com/ecom/products/finish-power-all-in-one-lemon-dishwasher-tablets/813324-728000-728001,Finish Power All in One Lemon Dishwasher Tablets,46Each,£10.00,21.7p each,,Household
445351,Finish Dishwasher Rinse Aid Original,G,false,79,https://ecom-su-static-prod.wtrecom.com/images/products/3/LN_445351_BP_3.jpg,https://www.waitrose.com/ecom/products/finish-dishwasher-rinse-aid-original/445351-62692-62693,Finish Dishwasher Rinse Aid Original,400ml,£5.20,£1.30/100ml,,Household
513494,Fairy Non Bio Washing Capsules,G,true,80,https://ecom-su-static-prod.wtrecom.com/images/products/3/LN_513494_BP_3.jpg,https://www.waitrose.com/ecom/products/fairy-non-bio-washing-capsules/513494-271169-271170,Fairy Non Bio Washing Capsules,33Each,£7.50,22.7p each,25% Off. Was £10.00,Household
709309,Essential Tie Handle Swing Bin Liners,G,false,81,https://ecom-su-static-prod.wtrecom.com/images/products/3/LN_709309_BP_3.jpg,https://www.waitrose.com/ecom/products/essential-tie-handle-swing-bin-liners/709309-795130-795131,Essential Tie Handle Swing Bin Liners,30s,£3.00,10p each,,Household
015603,Ecover Washing-Up Liquid Lemon & Aloe Vera,G,true,82,https://ecom-su-static-prod.wtrecom.com/images/products/3/LN_015603_BP_3.jpg,https://www.waitrose.com/ecom/products/ecover-washing-up-liquid-lemon-aloe-vera/015603-7497-7498,Ecover Washing-Up Liquid Lemon & Aloe Vera,950ml,£3.20,£3.37/litre,20% Off. Was £4.00,Household
